,book_idx,excerpt_idx,segment_idx,segment_1,segment_2,seg1_pos,seg2_pos,distance_bin,present_seg1_first
1741,72869,91,0,*There’s a story that Harry followed the first magistrate who convicted him half-way round the world—and got him. Since when*,*The girl realised at once the importance of finding out further details about this conference. If she could get a*,3026,16848,16000,0
1742,72869,92,0,"*She was looking into his face, and she would have sworn that there lurked in his eyes a glimmer of*","*The Tiger was in Baycombe, but with the removal of his gold the reason for his stay was also taken*",1183,12297,16000,1
1743,72869,93,0,"*The man was in plus-fours of a dazzling purple hue. He had a kind of haversack slung over his shoulder,*","*Miss Girton shrugged. “My dear child, I had to draw on that.” Patricia stared incredulously. Miss Girton, with a face*",1985,12198,16000,0
1744,72869,94,0,"*“They should be in about eleven, at this rate,” she reckoned. “You’d better go home and slip on a bathing*",*The girl guessed that Orace was still troubled with fears for her safety and doubts of her ability to pull*,6667,17710,16000,1
1745,72869,95,0,"*“Pat, you’re worth a fortune to this partnership! And I was just thinking we’d come to a standstill. Why, we*","*Once he knew where all the thorns were, and had tested their precise degree of spikiness, he grabbed up his*",7236,17808,16000,1
1746,72869,96,0,*he teased. “You’re a witch—but I’m too old and dusty to be vamped even by you.” But he threw down*,"*“But isn’t that old Carn’s job?” “It was the Saint’s idea,” she told him; “and it’s such a desperate gamble*",7812,19272,16000,0
1747,72869,97,0,"*Yours faithfully.” “You leave me very little choice, Mr. Templar,” said Bittle, and touched the bell. The Saint remained where*","*She smiled and shrugged her shoulders helplessly. The Saint grinned back and spread out his hands. Then, quite shamelessly, he*",5210,19830,16000,0
1748,72869,98,0,"*Is Miss Holm such an insuperable obstacle—to Supermen like yourselves?” “I think,” said Bittle smoothly, “that you would be wise*","*“Then that’s all to the good. Put it away in your pocket—but don’t flourish it about unnecessarily, because it belongs*",4648,18417,16000,1
1749,72869,99,0,*. .” The girl also was not unwilling to let Algy have his own way; in the grimness of her*,"*she sobbed, and would have run to him, but two of the guard clutched at her and dragged her back*",983,16381,16000,1
1750,72869,100,0,*But as a matter of fact I promised Miss Girton to join them in a sandwich and a glass of*,"*He went scraping through the shrubbery again to the wall, got his coat over the top as before, and was*",320,10509,16000,1
1751,72869,101,0,"*He had got her away, on an English tramp bound for Liverpool. “‘Saint,’” she had said—“that was a true word*",*And the Saint’s philosophy laid down the law that if you must stroll into the home-sweet-home of a bunch of*,8665,18753,16000,0
1752,72869,102,0,"*That was an honest toss-up with sudden death, and Simon took risks of that stamp without turning a hair. But*","*“We’m used to ut, zur,” he explained. “That be Maister Lomas-Coper. ’E do zometimes be out zhooting rabbuts.” “I see,”*",783,11603,16000,1
1753,72869,103,0,"*But she wondered if any man living except the Saint—her Saint—would have had the imagination to think of it, the*","*The man turned slowly, saucepan in hand. He saw a slim, straight slip of a girl in a tight-fitting Jantzen*",3767,19443,16000,0
1754,72869,104,0,"*“I’d hate to have to hurt you, Orace; but I will if you drive me to it. I’ve got to*","*You can ask Bittle.” She could not decide whether the man was lying or not, but she sensed that he*",1719,17627,16000,0
1755,72869,105,0,"*“They hardly seem to have moved in the last five minutes. Right under the Saint’s bedroom window, they’d have to*","*His blunderbuss was underneath the borrowed overalls, and he had no time to fumble for it before his opponent had*",342,11062,16000,0
1756,72869,106,0,"*she asked, and he almost glared at her. “Back ut arf pas’ sevin,” he growled. He picked up his tray*","*The cigarettes in his case, which might have been useful, had been ruined by the wet; but the case itself,*",6348,17280,16000,0
1757,72869,107,0,"*At the same time he replaced his own weapon in its concealed sheath. “Now we can be matey again,” remarked*","*“Also, there is quite a big prize at stake. I think we can rely on you.” The Saint stared back*",3678,14504,16000,0
1758,72869,108,0,"*Otherwise, the Tiger’ll go aboard himself, and that’ll be one more to pip—though the fish’ll be worth the extra trouble*","*“I can’t see you now.” The girl frowned. “It’s important,” she persisted. “I want to talk to you.” “Well, I’m*",2964,17934,16000,1
1759,72869,109,0,"*In spite of the protestations of Orace, he took a walk during the afternoon. He wanted to be familiar with*","*“Sorry, Aunt Agatha.” Miss Girton was absurdly pettish. “I decline to adopt you as a nephew, Mr. Lomas-Coper.” “Sorry, Aunt—Miss*",1074,12585,16000,0
1760,72958,0,0,*Chet seemed to aim at one of the forts. But his foot appeared to slip and the snowball smacked Con*,"*Once in a while I'd make some extra money, but it never lasted long somehow. I got a claim out*",197,1118,1000,1
1761,72958,1,0,*Joe was quickly overcome and the other pair would soon have beaten Frank into submission but for a surprising interruption.*,"*""It could have been worse. If those fellows had captured us we'd have likely been held prisoners in some out-of-the-way*",9384,10229,1000,0
1762,72958,2,0,"*It was a trail that had evidently been much used, for the snow was packed hard by the tramp of*","*They went across it, but were unable to pick up the trail again, although they searched about in every direction.*",15273,15361,1000,0
1763,72958,3,0,"*""Keep these boys here,"" he ordered. ""I'll be back in a while. Don't let them get away!"" ""Where are you*",*The idea had occurred to him that if he could but use one of them as a weapon he might*,3713,4084,1000,1
1764,72958,4,0,"*""I suppose you know the camp's broken up?"" he remarked. A look of surprise leaped into Slim's face. ""No,"" he*","*Frank shook his head. ""I think you'll be safer in behind the bars."" ""The sheriff's a good friend of our*",9041,9704,1000,1
1765,72958,5,0,"*I jumped back just in time."" ""Where are you now? Can't you reach me?"" ""The tunnel caved in, too. I'm*","*""We'd be wasting time trying. I guess the only thing we can hope for is that somebody heard the crash*",2547,3072,1000,0
1766,72958,6,0,*But when the boys turned to retrace their steps they were confronted by a lean form that barred their way*,*Joe leaped and scrambled into the opening. At the same instant the foremost wolf crouched for a spring. There was*,16324,17152,1000,1
1767,72958,7,0,"*Slim Briggs followed him into the cell. He looked around, plainly expecting to see the rest of the gang in*","*Still, the evidence seemed all against him. He had betrayed his comrades and decamped with their gold, according to Wilson's*",11449,11746,1000,1
1768,72958,8,0,"*Fenton Hardy leaned back on his pillow with a sigh. ""I cracked two of my ribs,"" he told them. ""Tumbled*","*It may not be the same fellow, but he mentioned a miner named Bart Dawson. Go on with the story,*",7757,8186,1000,1
1769,72958,9,0,"*""And I suppose you'll be almost heartbroken. No, there's to be no school to-morrow. Last night's blizzard was one of*","*Officer Riley eyed Chet suspiciously. The fact did not escape him that Chet had one hand behind his back. ""Aha!""*",5176,5893,1000,1
1770,72958,10,0,"*Had the Hardy boys but known it, the sharp-featured youth had been deputed by the mysterious Hopkins to report if*","*""You'd better go through the night train when it comes in. We'll keep on the lookout for 'em for a*",13865,14631,1000,0
1771,72958,11,0,"*He sat up in bed as they entered, and held out his hand. ""Hello, sons!"" he greeted them, with his*",*They would know that if I sent a message it would be to bring some one out here to help*,16629,17019,1000,0
1772,72958,12,0,"*It was about five feet from the ground. ""I'll hold the light,"" Frank said. ""See if you can clamber up*","*The old sky looks pretty good, doesn't it?"" ""Never looked so good to me before."" Joe put his foot on*",11497,12230,1000,0
1773,72958,13,0,*The door of the car flew open and the pair staggered from the running board into the roadway. They rolled*,"*""How come?"" ""They've been trying to keep us from catching a train to the West, and they mighty nearly got*",4867,5522,1000,0
1774,72958,14,0,"*""The only thing to do,"" said Frank, at last, ""is to keep on following this tunnel. There's no use going*",*The rush of cold air about their heads was soon quite evident. The boys' spirits rose forthwith and they proceeded*,15501,15844,1000,0
1775,72958,15,0,"*""I'm free."" He extricated his foot from the crevice and Joe lessened his weight on the bar. The boulder fell*","*""Let's hope so."" They continued, Frank flashing the light before him. The tunnel began to grow narrower. They had to*",11009,11740,1000,1
1776,72958,16,0,"*Do you know him?"" ""Why, that's the man Jadbury Wilson mentioned!"" Frank exclaimed. ""And who, may I ask, is Jadbury*","*asked Frank. ""One of the finest!"" declared their father promptly. ""He is a real square-shooter, as the miners would say.*",18170,18955,1000,0
1777,72958,17,0,"*came the cry. ""Help! Help!"" It came from somewhere immediately before them, and as the wind shifted just then Frank*","*To their unbounded astonishment they found that they were confronted by the side of a small cottage! In amazement, the*",367,427,1000,1
1778,72958,18,0,"*""Try it again, anyway."" Again Joe applied himself to the heavy rock. Although he strained and gasped in his efforts*","*You'll be able to move the boulder away without any trouble. Then we'll clear out of here."" Joe picked up*",16219,16346,1000,0
1779,72958,19,0,"*Frank produced his flashlight as he prepared to enter. ""Stick close behind,"" he advised his brother. ""We don't know what*","*They advanced several paces. The rustling sounds became multiplied. Then, suddenly, Frank caught sight of two gleaming pinpoints of light*",13063,13293,1000,0
1780,72958,20,0,"*But I'm afraid I'm not strong enough."" ""Try it again, anyway."" Again Joe applied himself to the heavy rock. Although*",*It was quite heavy and one end of it lay beneath a heap of rocks. Joe tugged at the iron*,3839,4151,1000,1
1781,72958,21,0,*The outlaws were silent. They saw that nothing was to be gained by seeking information from the lads. They were*,"*""Why?"" asked the boys, in surprise. ""You might have been buried alive in that mine, in the first place. I*",19150,19863,1000,1
1782,72958,22,0,"*They rolled about, fighting and struggling, while the man who had been hit with the wrench took occasion to deliver*","*""That gang were trying to kidnap us."" ""How come?"" ""They've been trying to keep us from catching a train to*",6771,7401,1000,1
1783,72958,23,0,"*""I'd have frozen to death if I'd been left pinned under that cot. I mightn't have been found for days.*","*""That's the main thing. And from the sound of that wind, it ain't as yet dyin' down any."" Frank Hardy*",1833,2272,1000,0
1784,72958,24,0,"*Gradually the scenery changed. The countryside altered in contour. The landscape became rockier and more mountainous, and on the second*","*The Hardy boys realized that if a gang were arrayed against them, as seemed only too evident from their experience*",1640,1764,1000,1
1785,72958,25,0,"*The conductor produced some tickets from his pocket and glanced through them. ""Even if he did,"" he remarked, ""they wouldn't*","*he asked. ""I made inquiries about your train and you'll be able to make it all right. Hop in."" He*",12822,13643,1000,0
1786,72958,26,0,"*""Where's the others?"" he demanded wrathfully. ""What others?"" asked the sheriff mildly. ""Black Pepper--the rest of the boys."" ""They ain't*","*Then, as Slim Briggs burst into a wild outbreak of bitter recrimination against the way in which he had deceived*",13628,13696,1000,1
1787,72958,27,0,"*Somebody locked _us_ in. Haven't you got a key?"" ""Jes' a minute."" They heard the porter shuffling away. After a*","*""It's about twenty miles across country. I'm motoring over there myself right now. You're welcome to come along with me*",13006,13879,1000,0
1788,72958,28,0,"*""It's not so easy if they know where to look for you, and I don't think they'll give up yet.*","*So, to make the transformation complete, they stopped at a bookstore and purchased two weighty volumes. And, when it came*",355,607,1000,1
1789,72958,29,0,"*""Dawson had lots of nerve. That's one thing I'll say for him although I'll never forgive him for what he*","*They raved and turned the whole cabin upside down huntin' for that gold, but it didn't do them no good.*",6227,6520,1000,0
1790,72958,30,0,"*Oh, well, we couldn't expect to find the gold right off the bat. There are lots of other mines to*","*""I wonder if anything has happened to him,"" he muttered. When another five minutes passed and there was still no*",16312,16508,1000,0
1791,72958,31,0,"*""It's--mighty--heavy!"" panted Joe, as he strove to move the heavy boulder. It refused to budge. ""Rest a bit and then*","*he declared, out of breath. Frank was silent. ""If we only had a crowbar of some kind!"" he suggested at*",19158,19381,1000,1
1792,72958,32,0,*That wolf would have been all over us in two more seconds. He'd have made mincemeat out of both of*,"*Frank, having the flashlight, took the lead. This tunnel, the main drift of the mine leading into the working level,*",19230,19664,1000,1
1793,72958,33,0,*He gave Frank but a fleeting glance as he went by and when Joe passed him later his gaze merely*,"*""Right through. There was no two boys on it. There was one lad sittin' in the Pullman readin' a book,*",11626,12356,1000,1
1794,72958,34,0,"*I'm just waiting until the line is clear so I can put through a telephone call."" ""Do you think we*","*He sprang forward, just dodged a sweeping blow of the wrench, and then wrestled with the boy. They swayed to*",6471,7243,1000,1
1795,72958,35,0,"*""Oh--a few dollars here and a few dollars there. Enough to keep me in grub and with a place to*","*""'Makes a man healthy and wealthy and wise,'"" finished Jadbury Wilson, with a wry smile. ""Well, I been gettin' up*",2179,2800,1000,1
1796,72958,36,0,*His assailant twined one foot about Frank's leg and they toppled over into the snow. By that time the thin*,"*What's your names?"" ""Tell us yours first."" ""What were you doing in that mine?"" ""What did you attack us for?*",19545,19742,1000,1
1797,72958,37,0,"*All right!"" he gasped. ""I give in."" There was something familiar about the voice. The man turned his head about*","*Slim, holding his hands above his head and keeping a wary eye on the weapon, got to a sitting position.*",11488,11565,1000,0
1798,72958,38,0,"*""Don't worry about us,"" chimed in Joe. ""We can look after ourselves. We probably won't be up against any worse*","*""I give in."" There was something familiar about the voice. The man turned his head about and they saw that*",16931,17880,1000,1
1799,72958,39,0,*Why should he return with one of the Coulsons? Could it be possible that the pair had been in league*,"*remarked Frank, with a laugh. ""He'll be kicking himself all around the cell for talking so much."" ""He was nicely*",8384,8929,1000,0
1800,72958,40,0,"*The trail now led toward a clump of trees, and here there were evidences of recent habitation. Some of the*","*One of these passages was marked with an X, and each passage led to a small chamber. From one of*",9415,10069,1000,1
1801,72958,41,0,"*""Do you feel well enough now?"" Joe got to his feet. ""Sure. I feel fine now. There's no use staying*","*But one's enough. Go ahead. It shouldn't be hard to find the Lone Tree from here."" Frank turned off the*",14878,15065,1000,0
1802,72958,42,0,"*He held the weapon negligently, but there was no doubt that he could level it at the Hardy boys in*","*asked the boys, in surprise. ""You might have been buried alive in that mine, in the first place. I would*",17815,18723,1000,0
1803,72958,43,0,"*And so sudden, too. I wonder what on earth he can want you for?"" ""Perhaps he needs our help on*","*Mrs. Hardy, who merely kissed them good-bye and told them to write to her as soon as they reached Chicago,*",6714,6951,1000,0
1804,72958,44,0,"*This gave them plenty of time for a good sleep, a bath and a leisurely breakfast. When all their preparations*","*""Who sent you, Mr. Hopkins?"" asked Frank politely. ""I am your father's lawyer--that is, in Chicago,"" said the neat little*",4455,4555,1000,1
1805,72958,45,0,"*Joe attacked another rock on the heap, edging the end of the crowbar into a crevice. ""How bad is the*","*See what you can do with that crowbar."" Joe inserted the end of the crowbar beneath the boulder, resting the*",16146,16289,1000,0
1806,72958,46,0,*The Hardy boys knew that they had wandered into a veritable den of timber wolves who had found in this*,"*The circle was narrowing. The animals were beginning to pace about the cave in long strides, drawing in toward the*",17829,17870,1000,1
1807,72958,47,0,"*The sheriff blinked, wavered, and finally gave in. ""I just wanted to make sure it was all right,"" he muttered.*","*""We didn't tell any lies about it. He took it for granted that the outlaws were arrested. All we did*",10426,11419,1000,0
1808,72958,48,0,"*When they reached Hank Shale's cabin they marched Black Pepper up to the door. Joe stepped inside and, still covering*","*""Here's a prisoner for your jail, sheriff! Clap him in a good strong cell!"" ""B--B--Black Pepper!"" stammered the sheriff. ""This*",18424,18905,1000,0
1809,72958,49,0,"*No, sah!"" protested the porter. ""Ah didn't have nuffin to do with it, sah! Dey come on at Chicago wif*",*He and Joe went back into the compartment and sat down again. This unexpected development left them silent and discouraged.*,13332,13709,1000,1
1810,72958,50,0,"*How about you?"" ""I'm shaken up a bit, but I'm all right. Thank goodness I didn't land on my head.""*","*They steer clear of that tunnel,"" ventured Frank. ""Lucky for us we hit the shaft when we did. That wolf*",17420,17592,1000,0
1811,72958,51,0,"*""Even if we only find the deserted camp we may get some clues that will help us."" The boys went*","*""Let's tackle him."" ""There may be others with him. Let him follow, and if he's alone we'll grab him."" Without*",8370,8490,1000,0
1812,72958,52,0,"*The dull ring of the iron bar seemed to sound their death-knell. ""I guess this is our finish, Frank,"" he*","*Then he heard Joe give a lusty shout of delight. ""It leads on up!"" he called. ""It is a tunnel*",5343,5807,1000,0
1813,72958,53,0,"*""Tumbled down off a big rock back in the mountains, and now I'm laid up until the ribs mend again.*","*And this gang I have been fighting are capable of anything."" ""Who are they?"" ""It's a long story, boys. But*",12853,13161,1000,1
1814,72958,54,0,*The flashlights were switched off and the brothers stood in total darkness. When their eyes became accustomed to the absence*,"*They remained still. Then, from above, at the top of the shaft, they could hear voices. ""That cave-in must have*",17037,17410,1000,1
1815,72958,55,0,"*""What's the matter?"" whispered Frank finally. ""I thought I heard a sound--like some one talking."" They listened again, but they*","*At the base of the pile he could see footprints, all of which led directly to or from the heap.*",15460,15660,1000,1
1816,72958,56,0,"*We worked it a few months longer, but it had petered out and the syndicate wouldn't take a chance on*","*Here they were all welcomed by Mrs. Hardy and Aunt Gertrude, who had been frantic with anxiety concerning the boys'*",6810,7475,1000,0
1817,72958,57,0,"*he asked, glancing quizzically at them. ""Yes."" ""I was told to be on the lookout for you,"" said the elderly*","*Frank went to the door. To his surprise he found that it would not open. He tried again, but the*",10681,11251,1000,0
1818,72958,58,0,"*""We never know what we'll find."" The boys made their way up into the mountains again and, after about an*","*At the edge of the clearing they waited, but still they heard nothing, and finally Frank was satisfied that the*",16651,17278,1000,1
1819,72958,59,0,"*He said nothing throughout the meal, but as he watched the boys eat and as he responded to their request*","*The abandoned working was but one of many in that locality, one lucky strike in the neighborhood having sent other*",7664,8249,1000,0
1820,72958,60,0,*They did not wish any interference from the stage driver or his passengers. When Frank and Joe saw that their*,"*Mr. Hardy looked grave. ""I think we'd better drop the case,"" he said finally. ""It's too big a risk to*",7344,7512,1000,1
1821,72958,61,0,*They deemed it best not to mention the fact that Jadbury Wilson suspected Bart Dawson of stealing from him. If*,"*""That's the supper call,"" laughed Mr. Hardy. ""You must be hungry after your journey. Better go and eat. Hank will*",12207,12421,1000,1
1822,72958,62,0,*The storm grew rapidly worse. The snowfall was so heavy that it obscured even the tops of the great masses*,*There was not the slightest vestige of a path. High above them they could discern the gloomy mass of a*,19649,19803,1000,0
1823,72958,63,0,*When they told him of the rough-looking man who had searched the train for them at the mining village he*,"*I managed to fight him off and disarmed him, but he got away so I chased him and it was*",8908,9374,1000,1
1824,72958,64,0,"*""That's up to you and the sheriff. If he tries to fix anything this time he'll get into trouble. We'll*","*The sheriff blinked, wavered, and finally gave in. ""I just wanted to make sure it was all right,"" he muttered.*",18409,18819,1000,1
1825,72958,65,0,*He appeared to be looking for some one. When Frank saw him next he was descending from one of the*,"*""Mebby they didn't get out of Chicago. The boys there might have picked up their trail again and caught 'em.""*",4327,4481,1000,0
1826,72958,66,0,"*If they're still hanging around we'll know there's still a good chance of finding it ourselves."" ""Where shall we look?""*","*""I think we're on the right track, all right,"" said Frank. ""Even if we only find the deserted camp we*",18602,18775,1000,0
1827,72958,67,0,"*You can see it from here."" He conducted them to the end of the platform and pointed to the top*","*he greeted them, with his cheerful smile. ""Glad to see you."" When greetings had been exchanged, Hank Shale took the*",2302,2569,1000,0
1828,72958,68,0,"*There was nothing to be done. Officer Riley had the authority, and he knew it. ""Well,"" said Chet Morton grimly,*","*With the greatest dignity that he could command under the circumstances, he brushed the snow off his uniform. Then, sadly,*",3785,4401,1000,0
1829,72958,69,0,"*""Have they left Lucky Bottom?"" asked Mr. Hardy quickly. Hank Shale shook his head. ""Nobody knows. They had a camp*","*""Just my luck,"" muttered the outlaw, in disgust. ""I might have known better!"" Still leveling the revolver at Slim, Frank*",18363,19151,1000,1
1830,72958,70,0,"*""I'm shaken up a bit, but I'm all right. Thank goodness I didn't land on my head."" ""What on earth*",*That passage we were in was a drift that went right through to the cave. We're at the bottom of*,19901,19935,1000,1
1831,72958,71,0,"*""You'd better let us go or the whole three of you will find yourselves in jail,"" said Frank. The man*",*asked Joe. The outlaws were silent. They saw that nothing was to be gained by seeking information from the lads.*,16687,17024,1000,1
1832,72958,72,0,*This would also give me a chance to tell you more about the mission I have decided to send you*,"*asked Frank politely. ""I am your father's lawyer--that is, in Chicago,"" said the neat little man. ""He sent me a*",333,882,1000,0
1833,72958,73,0,"*""Now I wonder how long we'll have to wait before we get a train back,"" remarked Frank. His eye caught*",*He was not going to be caught altogether unprepared. The car came to a stop. From around the front of*,9987,10652,1000,0
1834,72958,74,0,"*I thought sure we were done for, and then I stepped back--wow! I thought I was falling clean through the*","*This tunnel, the main drift of the mine leading into the working level, was not of great length, and within*",16057,16477,1000,0
1835,72958,75,0,"*""First of all, we'll read dad's letter,"" said Frank. ""These are the instructions he promised, I suppose."" He opened the*","*Frank paid the bill, and the boys were just about to move away from the desk when a neat, elderly*",3720,4270,1000,1
1836,72958,76,0,"*They may have taken it away right after they abandoned this camp. Well, we've just got to take our chances*",*The wind howled down from the crags and whistled through the trees. The entire mountain was veiled in a great*,17133,17395,1000,1
1837,72958,77,0,"*Come in,"" invited Hank Shale, standing aside to let them enter. ""We've been expecting you this last day."" The boys*","*We expected you here yesterday."" The Hardy boys glanced at one another. ""You must have enemies that knew we were*",6090,6406,1000,1
1838,72958,78,0,"*""I guess the boss will want to see these birds."" Frank and Joe were roughly bundled up the hillside again*","*Why are you keeping us here?"" The man in the fur coat became impatient at receiving questions instead of answers.*",7852,7966,1000,0
