,book_idx,excerpt_idx,segment_idx,segment_1,segment_2,seg1_pos,seg2_pos,distance_bin,present_seg1_first
2614,72963,84,0,"*But the flash of light is exactly along the grain, and there is no need of any artificial system of*",*It has about as much objectivity as a batting average. Whilst the physicist would generally say that the matter of*,4976,16949,16000,1
2615,72963,85,0,*We must leave this and return to a general consideration of the relation between classical laws and quantum laws. For*,*[33] The evidence is much stronger now than when the lectures were delivered. [34] The energy is required because on*,8847,19219,16000,0
2616,72963,86,0,*(2) It is taking the longest possible route through the curved space-time around the sun. (3) It is accommodating its*,*its view arises especially from a study of the meeting point of quantum and classical laws. The classical laws are*,361,15156,16000,1
2617,72963,87,0,*They continued to speak of orbits and orbit jumps but there was no longer a complete one-to-one correspondence with the*,"*We agree that at the end of the synthesis there must be a linkage to the familiar world of consciousness,*",3788,16457,16000,1
2618,72963,88,0,"*Disregard the fact that I introduced and to you as though they were not the same particles, because that begs*",*Presumably human nature has been specialised to a considerable extent by the operation of natural selection; and it might well*,5406,17557,16000,1
2619,72963,89,0,*Relativity of Length. There is no such thing as absolute length; we can only express the length of one thing*,*A few minutes before the arrival some person takes it into his head to go out and admire the glories*,240,13842,16000,1
2620,72963,90,0,*That is why there are many alternative orbits for the electron corresponding to different integral multipliers of . We call*,"*The progress of a wave is not progress of any material mass of water, but of a form which travels*",2054,16909,16000,0
2621,72963,91,0,*one of the simpler applications is to determine the changes of the physical properties of objects due to rapid motion.*,"*The more perfect the instrument as a measurer of time, the more completely does it conceal time’s arrow. This paradox*",719,11946,16000,0
2622,72963,92,0,*Where we cannot complete the mathematical chain we confess that we are wandering in the dark and are unable to*,"*These airy fancies which the mind, when we do not keep it severely in order, projects into the external world*",268,14235,16000,1
2623,72963,93,0,*His sole business is to see that the problem is correctly solved. But questions may be raised about a problem*,*But the evident possibility of arbitrariness in this valuation sets us hankering after a standard that could be considered final*,3183,16471,16000,0
2624,72963,94,0,*We have shown in this chapter that the limitation is not arbitrary; it is a necessary property of lengths expressed*,*In the model atom the electrons are supposed to traverse their orbits under the classical laws of electrodynamics; but they*,2427,12842,16000,1
2625,72963,95,0,*Here in effect it becomes a conflict between the corpuscular theory of light and the wave theory. In the early*,*These forms have a certain degree of permanence amid the shifting particles of water. Anything permanent tends to become dignified*,7688,19963,16000,1
2626,72963,96,0,*it is interested in him only as a component of a crowd. Therefore the method is applicable in fields of*,*I perform another experiment. This time I take two apples and drop them at opposite ends of the lift. What*,220,11578,16000,0
2627,72963,97,0,*His sole business is to see that the problem is correctly solved. But questions may be raised about a problem*,"*But although that is how the rainbow impresses itself on an impersonal spectroscope, we are not giving the whole truth*",2197,14830,16000,0
2628,72963,98,0,*Similarly for the other data of the problem. The softly yielding turf on which the elephant slid is replaced by*,*Human life is proverbially uncertain; few things are more certain than the solvency of a life-insurance company. The average law*,5257,19212,16000,0
2629,72963,99,0,*That does not give long for development; nevertheless the theory has already gone through three distinct phases associated with the*,"*The element of permanence in the physical world, which is familiarly represented by the conception of substance, is essentially a*",6148,16330,16000,1
2630,72963,100,0,"*it is inseparable from the conception of survey of the world from within—which is, I think, just the condition that*",*Conflict with the Wave-Theory of Light. The pursuit of the quantum leads to many surprises; but probably none is more*,6558,18801,16000,0
2631,72963,101,0,*It appears that in some circumstances the scale of the corresponding diffraction effects will not be too small for experimental*,"*“Ha!” said the Bursar, “I have discovered one of the great laws controlling the college. It is a perfect and*",3020,13093,16000,0
2632,72963,102,0,*Attention must be called to one highly important consequence of this theory. A small enough stormy area corresponds very nearly*,*“Knowableness to mind” is moreover a property which differentiates the actual world of our experience from imaginary worlds in which*,5588,19421,16000,1
2633,72963,103,0,*light travels in straight lines. He extends this flat frame to the surface of the earth where he encounters the*,"*The theory of sub-atomic energy has prolonged the life of a star from millions to billions of years, and we*",4055,19580,16000,1
2634,72963,104,0,*The suggestion may therefore be at once dismissed as fallacious. 2. The particles shot out by radioactive substances are electrons*,"*Do we then mean “later” as judged by the physical criterion of time’s arrow, i.e. corresponding to a greater proportion*",7154,17350,16000,1
2635,72963,105,0,*[14] It will probably be objected that since the phenomena here discussed are evidently associated with the existence of a*,*The yellow light from sodium consists of aethereal vibrations of period 510 billions to the second. At first sight we*,4218,18136,16000,1
2636,72963,106,0,"*But, before it was destroyed, the left-to-right organisation of molecular velocities was the exact numerical equivalent of the lost organisation*","*That gives a world containing gravitation limited by a law. The coefficients are naturally separated into two groups of ten,*",2551,16395,16000,0
2637,72963,107,0,*But in any case colour is no part of the essential nature of substance. Its supposed nature is that which*,"*After all if they try to enter we can pitch them out again, as Einstein pitched out the respectable causal*",491,11174,16000,1
2638,72963,108,0,*it is found that the lucid stars account for something approaching the total mass admissible and the amount left over*,*What precisely is the entity which we suppose to be oscillating when we speak of the waves in the sub-aether?*,1268,15431,16000,0
2639,72963,109,0,*There is no absolute velocity and no absolute rest for the star to come to. The suggestion may therefore be*,*We discover potential through the readings of a voltmeter. The numerical reading stands for something in the condition of the*,2700,13876,16000,0
2640,72972,0,0,"*""Not me."" ""You're sure?"" ""Sure."" ""Oh? Well, that doesn't alter the cardinal fact that you are the bloke who makes*",*At once Emily became herself again. All her sporting blood stirred in answer to these shouts. She forgot her agony.*,6841,7798,1000,0
2641,72972,1,0,"*Something resembling a smile flitted across his face, as if some pleasing thought was entertaining him. Mr. Molloy relaxed his*","*""And when I came to, as the expression is, the Case had gone. Where he is now, Mr. Twist, 'oo*",12744,13565,1000,0
2642,72972,2,0,"*It might have been intended to be genial, or it might not. Hugo could not tell. However, he was a*","*""You'd like Ronnie. He has an aunt in the looney-bin."" ""Do you consider that a recommendation?"" ""No, I just mentioned*",2359,2900,1000,1
2643,72972,3,0,"*The unhappy man emptied his glass, refilled it, and returned to the chair. ""In fact, it's a point verging very*","*What happened after that?"" ""Well, we buzzed along as well as we could, and we had just got to that*",8219,8738,1000,0
2644,72972,4,0,"*I wouldn't be happy outside of Oil."" ""Oh?"" said Mr. Carmody, regarding this Human Sardine with as little open hostility*","*People would come in their motors...."" ""I'm not stopping them,"" said Mr. Molloy generously. ""All I'm saying is that my*",9423,9571,1000,0
2645,72972,5,0,"*As day followed day her resentment grew, until now she had reached the stage when she was telling herself that*","*Her heart, she was compelled to realize, was now simply racing. A step sounded outside, a shadow fell on the*",9287,10059,1000,1
2646,72972,6,0,*It was the one strategic point not yet guarded by a stocky figure with large feet and an eye like*,"*Hell hath no fury like a woman scorned, and not many like a girl who's just had to give her*",7951,8679,1000,1
2647,72972,7,0,"*Mr. Twist was discouraged, but he persevered. ""I guess it looked funny to you, seeing me come in through a*","*""Were you at that concert?"" he said sternly. ""Me? No."" ""Are you sure, Twist? Look me in the face."" ""I've*",15083,15388,1000,0
2648,72972,8,0,"*he asked. ""Oh, gee!"" said Dolly. ""You know as well as I do there's dozens of people on the other*",*or I don't come in. You wouldn't have asked me to come in if you could have done without me.*,2445,3443,1000,0
2649,72972,9,0,"*From immediately behind them, as they stood facing the door, a voice spoke. ""I want my bag, Hugo."" It was*","*""But a country-house party with swell people...."" ""It isn't a country-house party. There's only the uncle besides those two boys*",5567,6307,1000,1
2650,72972,10,0,"*he finished the other egg, the bacon, the toast, the butter, the milk, and the coffee, and, having lifted the*","*The ruse proved effective. After a moment of complete silence, a board creaked. Then another board creaked. And then he*",14341,14934,1000,0
2651,72972,11,0,"*His uncle Lester John had always suspected of a complete lack of interest in the welfare of Rudge Hall; and,*","*His heart was jumping, and all the happiness which had been glowing inside him had leaped up into a roaring*",18818,19547,1000,1
2652,72972,12,0,"*""If you really want to know, I'm going to see Pat."" ""What on earth for? She'll be here to-morrow. I*","*I see it all. You've at last decided to propose to Pat. Am I right or wrong?"" John drew a*",5314,5480,1000,1
2653,72972,13,0,"*Compared with him, you are quite good looking. His ears alone...."" ""Good night,"" said John. He knocked out his pipe*","*""To-night? You thig I'm going out to-night with this code of mine, to clibe through windows and be run off*",2299,3081,1000,1
2654,72972,14,0,"*I've done my silver. It will be a pleasure to watch you, sir. Quite likely I can give you a*","*But he came ashore and had it. If you're looking for him, you will find him in the boathouse."" And*",4484,5412,1000,1
2655,72972,15,0,*The bars were firm. Tugging had no effect on them. There seemed to John only one course to pursue. He*,"*""Open this door at once, damn you!"" The Sergeant-Major shook his head. ""Language!"" he said reprovingly. ""Profanity won't do you*",5045,5429,1000,0
2656,72972,16,0,"*""Mr. Carmody has given me the day off. Mrs. Bolt's niece is being married over at Upton Snodsbury. And she's*","*""Miss Wyvern?"" ""Yes. Is that Sturgis? I say, Sturgis, what has become of Mr. Carroll? I was expecting him here*",8613,9502,1000,1
2657,72972,17,0,"*He had been standing by the table, and now, crumpling at the knees, he slid gently down to the floor.*","*""I'm listening, pettie!"" ""Everything's set."" ""Have you fixed that guy?"" ""Sure, precious. And Chimp, too."" ""How's that? Chimp?"" ""Sure. We*",18024,18173,1000,1
2658,72972,18,0,"*""And the dog?"" ""The dog's all right, sir."" ""That's splendid,"" said John. ""That's great. That's fine. That's capital. I'm delighted.""*","*asked John. ""It is impossible to say,"" replied Mr. Carmody. ""By a most unfortunate combination of circumstances the house was*",12493,13353,1000,1
2659,72972,19,0,"*""Just what the audience thought, apparently. What happened after that?"" ""Well, we buzzed along as well as we could, and*","*Hugo rose and wandered somnambulistically to the table. ""What are you doing?"" ""Working."" ""Working?"" ""Yes, working."" ""What at?"" ""Accounts. Stop*",19151,19468,1000,0
2660,72972,20,0,*I asked him if he thought he was trying to buy cheese sandwiches at the delicatessen store or something. Pierp.*,"*It was all very well for a man like Mr. Molloy to speak sneeringly of $700,000. To most people--and Mr.*",6983,7109,1000,1
2661,72972,21,0,*In the matter of tea-drinking John was handicapped by the fact that he had just swallowed approximately a third of*,"*I am Doctor Twist's assistant."" ""But this man is a criminal, you fool...."" Sergeant-Major Flannery seemed pained rather than annoyed.*",11104,11353,1000,0
2662,72972,22,0,*His happiness swelled into a feeling of universal benevolence toward all created things. He looked upon the birds and found*,"*Remorse gripped John. He felt like a sentinel who, falling asleep at his post, has allowed the enemy to creep*",11031,11836,1000,0
2663,72972,23,0,"*""Right ho,"" said Emily. ""You'll be coming soon, I suppose?"" She charged up the stairs, glad to get to her*","*Non-army men may grow moustaches and wax them and brood over them and be fond and proud of them, but*",2576,3544,1000,0
2664,72972,24,0,"*""But are we going to sit still and let perishers with waxed moustaches burgle the house whenever they feel inclined*",*Keep plugging away at that Molloy girl. I think you're beginning to make an impression. I think she's softening. I*,1767,2504,1000,0
2665,72972,25,0,"*He was speaking of rabbits he had known in his hot youth--their manners, customs, and the amount of lettuce they*","*""I've been trying to get a word with you all the morning. But that darned policeman was around all the*",12768,13655,1000,0
2666,72972,26,0,"*""Oh?"" said John, uninterested. ""And to prevent Uncle Lester making a fuss about this, I've invited old man Molloy and*","*is rolling in money, and, once Uncle Lester learns that, he won't kick about Ronnie being there. He loves having*",16943,16977,1000,1
2667,72972,27,0,"*To Birmingham, probably. The only place you ever went to from Rudge after nightfall was Birmingham. John thought he could*",*A wave of irritation passed over John. Two long drives in the Widgeon Seven in a single day had induced*,4764,4891,1000,0
2668,72972,28,0,"*He had feared that this talk of theirs might be about to end all too quickly, and these explanations helped*","*""I want the car."" ""I've just put it away, sir,"" said Bolt, speaking more slowly and with the manner of*",6146,6944,1000,1
2669,72972,29,0,"*But dairy farmers have second thoughts. The door opened again. ""I was forgetting,"" said John, poking his head in. Mr.*","*""The only good golf course in Worcestershire at present is at Stourbridge. Worcestershire needs more golf courses. You know how*",18698,19560,1000,1
2670,72972,30,0,"*Do you suppose I go about the place croaking people? He's all right."" ""Well, he didn't look it. If I'd*","*Then we wouldn't have had all this trouble. From what I can make of it, you seem to have roused*",945,1318,1000,1
2671,72972,31,0,"*I began in Oil and I'll end in Oil. I wouldn't be happy outside of Oil."" ""Oh?"" said Mr. Carmody,*","*Small though it is, never forget that it lies just off the main road in the heart of a prosperous*",19434,19561,1000,0
2672,72972,32,0,"*shrilled Mr. Twist, quivering with self-pity. ""A nice thing that was that wife of yours did to me! A fine*","*""I will, will I? And while I'm doing it, you'll just sit back, I suppose, and have a nice rest?*",14151,14961,1000,0
2673,72972,33,0,"*""I will,"" said John. He accompanied his cousin down the stairs and out into the stable yard. Having watched him*","*Why Doctor Twist, of all people? Why not the vicar or Chas. Bywater? Footsteps sounded on the gravel, and he*",12016,12297,1000,1
2674,72972,34,0,"*When Doctor Twist had undertaken the contract of making a new Lester Carmody out of the old Lester Carmody, he*","*For July had come in on golden wings, and the weather now was the kind of weather to make a*",9403,10257,1000,1
2675,72972,35,0,"*You're going to marry me, and the sooner you make up your mind to it, the better."" That was what*","*John heaved a silent sigh. Yes, he could have counted on Hugo arriving at just this moment. He turned, and*",11646,11807,1000,0
2676,72972,36,0,"*I'm a broken man."" ""Only cracked, I should have said."" Hugo was not attuned to cousinly badinage. He frowned austerely.*","*Hugo heaved himself from the chair, looking more Russian than ever. John watched his operations with some concern. ""Aren't you*",14330,14374,1000,0
2677,72972,37,0,"*Most certainly, felt the Twentieth-Century John, it would not be wise. Very clearly Pat had shown him, that night in*","*""How do you mean, slow?"" ""Well, don't you think you're slow?"" ""In what way?"" ""Oh, just slow."" In spite of*",14606,15592,1000,1
2678,72972,38,0,*A moment later it had become plain that the dashing exterior of Miss Molloy was a true index to the*,"*""Oh?"" said John, uninterested. ""And to prevent Uncle Lester making a fuss about this, I've invited old man Molloy and*",8613,9576,1000,1
2679,72972,39,0,"*""And why, when you can buy insecticide at any drug store, people let these boys with the shiny hair go*",*But he was not left to himself. A moment later it had become plain that the dashing exterior of Miss*,13936,14374,1000,1
2680,72972,40,0,"*""I've got a bit of bad news for you, Carmody,"" said Mr. Fish. ""Brace up, my dear fellow."" Mr. Carmody*","*Of course there wasn't anything of the sort on the premises. For, mark this, my dear Carmody: according to his*",14773,14831,1000,1
2681,72972,41,0,"*""Come down,"" called John. There was a scrabbling on the stairs. Emily bounded out, full of life. ""Well, well, well!""*","*""You back?"" ""Come along."" ""What's up? More larks?"" ""Don't make such a beastly noise,"" said John. ""Do you know what*",4095,4117,1000,0
2682,72972,42,0,"*""I have been thinking the matter over very carefully, and I feel that this is an affair where we require*",*Absolutely. He's quite _non compos_. Mad as a coot. Belfry one seething mass of bats. He's taken to climbing ladders*,778,1595,1000,0
2683,72972,43,0,"*""Hullo, John,"" said Hugo. ""So there you are, John. say, John, I've just been paying a call on the head*","*John melted. His mood had softened, and he was in a fitter frame of mind to remember that he had*",1056,1894,1000,1
2684,72972,44,0,"*""Yes."" ""Having risen from couch at five-thirty ante meridian?"" ""Will you kindly stop asking me all these questions."" Hugo regarded*","*""You see, if I thought we were getting in somebody you knew nothing about and felt you couldn't trust, it*",314,925,1000,1
2685,72972,45,0,"*""They were, rather,"" said Pat. The spell of the summer night held them silent again. No sound broke the stillness*","*He might at least apologize."" John did not reply for a moment. He was thinking that whoever tried to make*",13909,14053,1000,1
2686,72972,46,0,"*""Let's get this clear,"" he said. ""You expect my uncle Lester to think beautiful thoughts?"" ""All the time."" ""Even under*","*""Blast you!"" said his cousin John, appearing from nowhere. ""Get out of that car."" ""Hullo, John,"" said Hugo. ""So there*",305,628,1000,1
2687,72972,47,0,"*Pat scrambled out and bent down to where he sat, holding to the bank. ""I'm not nearly so beastly now,*","*Could these things be on such a day as this? ""You don't say so?"" ""Yes, Mr. John. I was awake*",18469,19461,1000,1
2688,72972,48,0,"*""Are you sure, Twist? Look me in the face."" ""I've never been near any concert."" ""I strongly suspect you,"" said*","*""You're sure?"" ""Sure."" ""Oh? Well, that doesn't alter the cardinal fact that you are the bloke who makes poor, unfortunate*",15679,15722,1000,1
2689,72972,49,0,*He accompanied his cousin down the stairs and out into the stable yard. Having watched him move away and feeling*,"*Directly I got into the house just now Uncle Lester called me to his study, handed me this cheque, and*",14264,14639,1000,0
2690,72972,50,0,"*""Yes,"" he said complacently, ""that's a face which for business purposes is a face. I may not be the World's*","*Mr. Molloy, though conceding that this was the right spirit, was obliged to discourage his wife's pretty enthusiasm. ""Where could*",18452,18907,1000,0
2691,72972,51,0,"*""You back?"" ""Come along."" ""What's up? More larks?"" ""Don't make such a beastly noise,"" said John. ""Do you know what*",*It was almost as though an inner voice were whispering to him that he was on the brink of some*,16306,16471,1000,0
2692,72972,52,0,"*He would vastly have preferred to keep it a nice, cosy affair among the three of them. But it was*","*""I don't want to call in Chimp any more than you do. But there's this thing of getting the stuff*",3811,3846,1000,0
2693,72972,53,0,"*Hugo, meanwhile, had made the interesting discovery that it was no stranger who stood before him but an old acquaintance.*","*""Remember March, the Ides of March remember! Did not great Julius bleed for justice' sake? What villain touched his body*",18364,18471,1000,0
2694,72972,54,0,"*There was a gleam in his eyes which, in Mr. Twist's opinion, was far too wild to be agreeable. ""I*","*With the drawbacks to his present situation he had instantly become acquainted, but now at last one advantage presented itself*",19070,19672,1000,0
2695,72972,55,0,"*But at the end of the second week Mr. Carmody, learning from his nephew Hugo that an American millionaire was*","*On such a morning, felt Mr. Carmody, anybody ought to be willing to put up any sum for anything. Nature*",14152,15016,1000,1
2696,72972,56,0,"*Hugo's third stride took him well into the abyss. He clutched out desperately, grasped only cool Worcestershire night air, and*","*""What's up?"" Weighed down by the burden of his many sorrows, Ronnie Fish had come to this terrace path to*",10152,10229,1000,0
2697,72972,57,0,"*""What's 'appened 'ere is that that nasty, feverish cold of yours has gone and struck inwards. It's left your 'ead*","*If you take my advice, you'll get off to bed and put an 'ot-water bottle on your stummick. Lay it*",12752,13296,1000,0
2698,72972,58,0,*It was places like the Mustard Spoon that made a man despair of progress. He disliked the clientèle. He disliked*,"*See you anon. And, if there's anything you want, order it, paying no attention whatever to the prices in the*",7968,8193,1000,1
2699,72972,59,0,"*""All right, baby. If you say so. You always were the brains of the firm. If you think it's kayo,*","*But there's this thing of getting the stuff out of the house."" ""What you were saying just now,"" Mrs. Molloy*",6304,6486,1000,0
2700,72972,60,0,"*""But suppose he hasn't been able to?"" said Mr. Twist with a return of his old nervousness. ""Suppose he hasn't*","*she said, returning. ""What were you doing, honey? Did you hear somebody?"" ""No. I caught sight of a bunch of*",4545,4843,1000,1
2701,72972,61,0,"*""That's Him,"" said Mrs. Evans. ""Go and see what He wants."" She usually referred to the proprietor of Healthward Ho*",*The actual sound he now uttered was not unlike that which might proceed from the fog horn of an Atlantic*,12808,13668,1000,0
2702,72972,62,0,"*""Where have you been?"" he asked in a flatter voice. A rather peculiar smile came and went on John's face.*","*he said carefully. ""Yes,"" said John. ""Most hospitable he was. I can't say I liked him, though."" ""No?"" ""No. Perhaps*",16027,16163,1000,1
2703,72972,63,0,"*Well, that took us off. Ronnie got rather a beefy whack on the side of the head and exited rapidly.*","*""Accounts. Stop fiddling with those papers, curse you."" ""What's this thing?"" ""That,"" said John, removing it from his listless grasp*",1607,1806,1000,1
2704,72972,64,0,"*Snap into it!"" replied Emily curtly, impatient at this foolery. ""Hear her speak for it?"" said Mr. Bywater. ""Almost human,*","*Her heart, she was compelled to realize, was now simply racing. A step sounded outside, a shadow fell on the*",429,599,1000,0
2705,72972,65,0,"*Be human, why can't you, you poor lump of Camembert."" ""I'm human all right."" ""You've got to prove it to*","*Mrs. Molloy expressed the view that this was tough on the magpie, but wanted to know what the bird's misfortune*",18786,19082,1000,1
2706,72972,66,0,"*No...! No, it doesn't matter."" ""Very good, miss."" Sturgis returned to his pantry. Pat, hanging up the receiver, went out*",*But never had he experienced anything to compare with what he was feeling now. He was dimly conscious that strange*,13002,13256,1000,1
2707,72972,67,0,"*""What a weird notion! After all these years? Good heavens, no. I'm much too fond of you, Johnnie."" Once more*","*""Of course not. Though it would have been cosier, just we three."" ""Quite true. But never forget that, if it*",4487,5003,1000,1
2708,72972,68,0,"*and Pat, puzzled to conjecture the reason for so abrupt a departure, received illumination a moment later when she saw*","*She looked back at a night, some centuries ago, when a fool of a girl had refused the offer of*",19239,19669,1000,0
2709,72972,69,0,"*""The dog's all right, sir."" ""That's splendid,"" said John. ""That's great. That's fine. That's capital. I'm delighted."" He smiled a*","*Could these things be on such a day as this? ""You don't say so?"" ""Yes, Mr. John. I was awake*",9243,9600,1000,0
