,book_idx,excerpt_idx,segment_idx,segment_1,segment_2,seg1_pos,seg2_pos,distance_bin,present_seg1_first
0,69087,0,0,*When she is half-way down she hears the chink of glass from the hall. She has not a doubt of*,"*“The money,” said Blunt sharply. There was a silence which lasted for at least a minute. Then Flora drew herself*",14310,14991,1000,1
1,69087,1,0,"*The room is not too hot, no?” I thought it was stifling, but refrained from saying so. The windows were*","*He entered into no explanations, but at once started a new subject of conversation. “The housekeeper, Miss Russell, who came*",12686,13043,1000,1
2,69087,2,0,"*“An opened window,” he said. “A locked door. A chair that apparently moved itself. To all three I say, ‘Why?’*","*I think the same thought must have occurred to Colonel Melrose, for he frowned. “Anything more you want to see,*",5927,6001,1000,0
3,69087,3,0,"*Kent glared at us sullenly, but did not reply. I saw his glance waver over the three of us, and*",*What’s that to do with it? Is a man whose name is Kent bound to be born in that particular*,315,909,1000,0
4,69087,4,0,"*Poirot tore it open. Blunt’s voice rose abrupt and resonant. “The murderer is amongst us, you say? You know—which?” Poirot*",*Poirot sat down and drew out his case of tiny Russian cigarettes. He smoked for a minute or two in*,18767,19044,1000,0
5,69087,5,0,"*It was then just on half-past nine, as I tell you.” Poirot nodded again. He made a note or two*",*“Every time we come back to Ralph Paton. How did you manage to spot Miss Russell as the person Charles*,16913,17081,1000,0
6,69087,6,0,"*Poirot wanted to live quietly without being bothered by people.” “So that’s who he is,” I said slowly. “You’ve heard*","*Since the girl was determined, I was forced to give in to her and we started at once, getting away*",3215,4009,1000,1
7,69087,7,0,*Caroline’s attention was distracted from her own inventive exercises. She pointed out to Miss Ganett that a hand consisting of*,*I was overwhelmed and intoxicated. I had read of there being such a thing as the Perfect Winning—going Mah Jong*,10757,11146,1000,0
8,69087,8,0,"*It’s God’s own truth what I told the police. I heard the word blackmail, sir, and well——” He paused. “You*","*He leaned forward. “Had you any reason to suppose before that night that Mr. Ackroyd was being blackmailed?” “No, indeed,*",302,365,1000,1
9,69087,9,0,"*“How—changed?” I asked. “Looked ten years older.” “Were you down here when her husband died?” I asked, trying to make*","*I agreed. “Ashley Ferrars was by no means a pattern husband,” I said cautiously. “Blackguard, I thought,” said Blunt. “No,”*",10118,10161,1000,1
10,69087,10,0,"*Poirot came in practically the minute after he left.” “Came in here?” “No, to his own house.” “How do you*","*“Ah!” said Poirot regretfully. “That is a pity.” And he seemed quite crestfallen. He entered into no explanations, but at*",17059,17751,1000,0
11,69087,11,0,"*But they’re wonderful fellows, these foreign detectives. Up to all sorts of dodges, I believe.” “Pung,” said Miss Ganett, in*","*You sit there like a dead head, and say nothing at all!” “But, my dear,” I protested, “I have really*",13503,13568,1000,0
12,69087,12,0,*| |LODGE -----------------+ +---+-------------- ] The inspector took in the position at a glance. We went through into the large*,*She can answer my questions better without being upset by knowing the truth about her uncle. Tell her there’s been*,5745,5844,1000,1
13,69087,13,0,"*“But I never hurt a hair of Mr. Ackroyd’s head,” he moaned. “Honest to God, sir, I didn’t. I’ve been*","*The lawyer was in his office, and we were ushered in without any delay. He rose and greeted us in*",14257,15036,1000,1
14,69087,14,0,"*“When do you want me to do this?” “Now, if you will. We are close to the house.” “Aren’t you*","*For a moment or two the girl looked mutely at Poirot. Then, her reserve breaking down completely, she nodded her*",14212,15085,1000,0
15,69087,15,0,*I have always been considered so—so very respectable. If any one got an inkling—it would have been all up with*,"*But let us not be in a hurry. Let us proceed slowly, with due order and method. Charles Kent is*",6654,6916,1000,1
16,69087,16,0,*It was this same table lid being shut down gently and carefully. I repeated the action once or twice for*,*They’re not wearing or using them now. The pen that George Eliot wrote _The Mill on the Floss_ with—that sort*,376,578,1000,0
17,69087,17,0,"*And why?” “You think she went to meet some one?” “I do.” Poirot nodded. “So do I,” he said thoughtfully.*","*A question of the relativity, is it not so? Have you reflected, my friend, that many people in that house*",18989,19647,1000,0
18,69087,18,0,"*I opened the door and walked in. As I did so, I almost collided with Miss Russell, who was just*",*I was still bending over the open silver table when Flora Ackroyd came into the room. Quite a lot of*,5051,5514,1000,0
19,69087,19,0,"*Was it because, as in the case of questioning Major Blunt, he wished to remain in the background? The wish,*","*I hadn’t the least idea of it.” “Can you tell me anything about her?” I asked. “Anything about her?” “Yes,*",10763,11041,1000,0
20,69087,20,0,"*After all, I read detective stories, and the newspapers, and am a man of quite average ability. If there had*",*I want Colonel Melrose to see everything exactly as it is. I happen to know that he’s dining out the*,447,1233,1000,1
21,69087,21,0,"*No doubt whatever.” “Where was this—er—curio usually kept? Can you tell me that, sir?” It was the secretary who answered.*","*“It’s nothing.” “Yes, doctor?” said the inspector again, still more encouragingly. “It’s so trivial,” I explained apologetically. “Only that when*",7493,7534,1000,1
22,69087,22,0,"*Miss Russell rose. “Thank you very much, M. Poirot,” she said. “You have been very kind—very kind indeed. You—you do*",*I think Miss Russell knows more about Mr. Ackroyd’s death than she is prepared to admit.” Caroline leaned back triumphantly*,12484,12920,1000,0
23,69087,23,0,"*“And then that scene—yesterday,” continued my patient. She paused as though expecting me to take up a cue. “What scene?”*","*Of the six people round the table yesterday, Mrs. Ackroyd at least had had something to hide. It was for*",3079,3558,1000,0
24,69087,24,0,"*“It’s a habit they have,” I agreed. “And the tone altered—became quite abusive. I assure you, doctor, I was becoming*","*And I went into Roger’s study—I had some real reason for going there—I mean, there was nothing underhand about it.*",2725,3011,1000,1
25,69087,25,0,"*“A very meticulous and accurate account,” he said kindly. “You have recorded all the facts faithfully and exactly—though you have*",*Now let us begin—but first I have an announcement to make to you all.” He took Ursula’s hand and drew*,19528,19974,1000,0
26,69087,26,0,"*“Every one was out, or so I thought. And I went into Roger’s study—I had some real reason for going*","*“Why did you leave the lid open?” I asked. “Did you forget?” “I was startled,” said Mrs. Ackroyd. “I heard*",12300,13038,1000,0
27,69087,27,0,"*“I shall have to pack this carefully,” he observed. “It’s going to be an important piece of evidence in more*","*I took a turn or two up and down the room. “Flora,” I said gravely, “be guided by me. I*",5422,6285,1000,0
28,69087,28,0,"*This fellow doesn’t seem out after kudos, does he? Would work in with us unobtrusively, eh?” “To the greater glory*","*“The bell rang, sir,” he said hesitatingly. “Come in, Parker,” said Colonel Melrose. “This gentleman wants to ask you something.”*",13191,14043,1000,1
29,69087,29,0,"*“No, sir. That is Elsie’s work. I never went near that part of the house.” “I must tell you, my*","*What did you think of that girl?” “Which girl? The parlormaid?” “Yes, the parlormaid. Ursula Bourne.” “She seemed a nice*",13140,13721,1000,0
30,69087,30,0,"*In the two years that Geoffrey Raymond has been secretary to Ackroyd, I have never seen him ruffled or out*","*“You’re quite sure about it, sir. You identify it positively?” “Absolutely. No doubt whatever.” “Where was this—er—curio usually kept? Can*",8104,8233,1000,1
31,69087,31,0,"*“Nonsense,” said Caroline. “I have always said ‘_Chow_.’” “In the Shanghai Club,” said Colonel Carter, “they say ‘_Chow_.’” Miss Ganett*",*“She came here pretending to consult James on Friday morning. It’s my opinion she wanted to see where the poisons*,11392,12241,1000,0
32,69087,32,0,"*“Every one has something to hide,” I quoted, smiling. “Exactly.” “You still believe that?” “More than ever, my friend. But*","*“I shan’t forget,” said Hector Blunt. He added, in a sudden burst of communicativeness:— “Time I went. I’m no good*",10027,10623,1000,1
33,69087,33,0,"*But any one who was a friend to him would tell him this: he ought to come back.” I lingered,*",*“Not earlier? Not before a quarter to ten?” I looked at her attentively. She was so clearly eager for a*,11775,11834,1000,1
34,69087,34,0,*I followed him. He led me down a path to the left enclosed in yew hedges. A walk led down*,*“Not—not while we’re in all this trouble. Oh! please. If you go——” She turned away a little. “You want me*,4188,4780,1000,0
35,69087,35,0,"*Here, or at the Three Boars?” Mrs. Ackroyd stared at me with a dropped jaw. “The inquest?” she asked, the*","*“If Mr. Ackroyd paid that money away himself, it may have a bearing on the mystery of the crime. The*",17543,18311,1000,1
36,69087,36,0,"*she asked. “I don’t quite understand, you know——” Poirot smiled admiringly at her. “It is not necessary that you should,”*",*asked the colonel. “I’ll Pung that Green Dragon. How do you make out that Miss Flora’s been lucky? Very charming*,4556,5391,1000,0
37,69087,37,0,"*“I assure you,” I said, “that I don’t know anything. Poirot keeps his own counsel.” “Wise man,” said the colonel*",*Ah!” Out of the babel of excited suggestions and suppositions three theories were evolved:— 1. That of Colonel Carter: that*,8499,8792,1000,0
38,69087,38,0,*_I_ think there’s something fishy about her. She was certainly doing her best to marry Roger. But I soon put*,"*I began to wonder if there was any chance of stemming Mrs. Ackroyd’s eloquence, and getting away. Mr. Hammond provided*",13203,13236,1000,1
39,69087,39,0,"*“Including mine,” I said dryly. “Very well. None of them correspond. That leaves us two alternatives. Ralph Paton, or the*","*And now that we are left to our own devices, what do you think, my good friend, of a little*",1426,1830,1000,1
40,69087,40,0,"*“Ursula Bourne?” she said hesitatingly. “Yes,” I said. “Perhaps you don’t remember the name?” “Oh, yes, of course. I—I remember*",*“I’m afraid I don’t remember.” There was a spark of anger now underlying her nervousness. She flung up her head*,2896,3039,1000,1
41,69087,41,0,"*Then he nodded his head and remarked, “I think I’d better have a word with Miss Russell, and I’ll see*","*“Of course,” I admitted, “we don’t know what those papers may have been. But Raymond certainly said——” “Leave M. Raymond*",3798,4646,1000,1
42,69087,42,0,"*“I’m afraid there isn’t. There’s _curare_, of course.” I told her a good deal about curare, but she seemed to*",*said Caroline. I could see her nose twitching as she worked on this. “He arrived at the Three Boars yesterday*,1064,1299,1000,0
43,69087,43,0,"*“There’s only one thing against it,” I said slowly. “If Ackroyd went on reading that letter as soon as I*","*“Quite a work of art. There can’t be many of them about.” It was indeed a beautiful object. A narrow,*",2638,3009,1000,1
44,69087,44,0,"*“Nothing to be said,” interpolated Blunt. “She’s doing the right thing. I’ll stand by her through thick and thin.” Flora*","*“Will no one speak?” He gave the same short laugh again. “_C’est dommage_,” he said, and went out. That evening,*",10307,10723,1000,1
45,69087,45,0,"*But it soon transpired that his thoughts were occupied by something of a totally different nature. “See you,” he said.*","*I perceive you have purchased £500 of National Savings Certificates this year?” “Yes, sir. I have already over a thousand*",1773,2762,1000,0
46,69087,46,0,"*“Newspaper paragraphs are not always true, mademoiselle,” murmured Poirot, having the grace to look ashamed of himself. “All the same,*","*I queried. “That’s what I said. Why did you do it, child? For a wager?” “For a living,” said Ursula*",18387,18608,1000,0
47,69087,47,0,*It was the goose quill we had found in the summer-house. At the sight of it the man’s face changed.*,"*“Nothing whatever,” said Poirot mildly. “A little idea of mine, that was all. Me, I am famous for my little*",9083,9688,1000,1
48,69087,48,0,*“Good man. Hand them over now.” “They’re in my bag in the hall. I’ll get them.” Ackroyd arrested me. “Don’t*,"*Nobody can overhear; don’t be uneasy.” “Sheppard, nobody knows what I’ve gone through in the last twenty-four hours. If a*",1298,1536,1000,0
49,69087,49,0,"*“That is where we disagree, you and I. Three motives—it is almost too much. I am inclined to believe that,*","*As I say, up till the Monday evening, my narrative might have been that of Poirot himself. I played Watson*",5227,5396,1000,1
50,69087,50,0,"*Flora had turned to the secretary. “Will you send the announcement to the _Morning Post_ and the _Times_, please, Mr.*","*“Mademoiselle,” said Poirot, “will you let an old man congratulate you on your courage and your loyalty? And will you*",13142,13319,1000,1
51,69087,51,0,"*I felt myself getting hotter and hotter, and more and more incoherent, as I floundered through the above speech. Poirot*","*“Good, all is in readiness.” The door opened and the party from Fernly filed in. Poirot went forward and greeted*",17598,18405,1000,0
52,69087,52,0,"*“That is what put cocaine into her head, my friend,” he said. I would have catechized him further, for I*","*“How much later? After Blunt and Raymond were in the room, or before?” “I can’t remember,” I said slowly. “I*",3257,3981,1000,0
53,69087,53,0,"*“You know it already,” said Ralph. “There’s very little for me to add. I left the summer-house about nine-forty-five, and*",*He tapped the crumpled ball of paper. “What is that?” said Raymond sharply. “A wireless message—from a steamer now on*,19601,19887,1000,0
54,69087,54,0,"*I suggested strolling on the terrace, and he acquiesced. Poirot stayed behind. I stopped to examine a late rose. “How*","*_I_ saw through her.” I began to wonder if there was any chance of stemming Mrs. Ackroyd’s eloquence, and getting*",13094,13881,1000,1
55,69087,55,0,"*“I was at home by a quarter-past nine,” I said. “I didn’t go out again until I received the telephone*",*. . . . . . . . PATH . . . . . .. LAWN . . . .*,5818,6706,1000,1
56,69087,56,0,"*We went to the drawing-room, but on the way the constable waylaid the colonel, and after a muttered conversation the*","*Now, I’m a plain man——” “Mrs. Raglan would not agree, I am sure, to that,” said Poirot, making him a*",14403,14676,1000,1
57,69087,57,0,"*“Yes. Dr. Sheppard speaking.” I listened for a minute or two, then replied briefly. Replacing the receiver, I went back*",*You’ve got permission to do anything you please. Inspector Japp of Scotland Yard was asking after you the other day.*,12686,13158,1000,0
58,69087,58,0,"*I am never ridiculous.” “But you brought your hand out empty,” I objected. “There are times when it is necessary*","*You understand the kind of thing I mean. And while he replies, watch his face without seeming to watch it.*",18451,19379,1000,0
59,69087,59,0,"*The man had gone to pieces, his cheeks shook flabbily. “You see, me, I have made inquiries,” said Poirot pleasantly.*","*“Ah! yes,” said Poirot, smiling broadly. “I hope you’re not annoyed? It was very careless of me.” “But not at*",3357,4118,1000,1
60,69087,60,0,*I myself am perhaps an instance. A year ago I came into a legacy—enough to enable me to realize a*,"*“That must be Captain Ralph Paton,” I said slowly. “I have not seen him about here before?” “No, he has*",2080,2702,1000,1
61,69087,61,0,"*Any hints would certainly have been wasted on Caroline. “You see,” she explained, following directness with tact, “Dr. Sheppard being*","*We were ushered into a little sitting-room arranged with formal precision, and there, after the lapse of a minute or*",14765,15403,1000,0
62,69087,62,0,*Mrs. Ackroyd’s got an alibi. Even that Russell woman seems to have one—and a good job for her it is*,*He must have more—and more! He is intoxicated by the gold mine which has opened at his feet. He becomes*,16783,17017,1000,1
63,69087,63,0,"*“So do I,” he said thoughtfully. There was a pause. “By the way,” I said, “I’ve got a message for*","*“Not at all,” I said. “When the professional part of the conversation was over, we talked for a few minutes*",5509,5631,1000,1
64,69087,64,0,*Parker seated himself with an apologetic bend of the head. “Now what do you think I asked you to come*,"*“No, indeed, sir. It was a great surprise to me. Such a regular gentleman in all his habits.” “How much*",6727,7241,1000,0
65,69087,65,0,"*No. 2, my humble self. One from Major Blunt will be forthcoming in the morning.” Youth is very buoyant. Even*","*On my return Caroline came into the hall to greet me. “Flora Ackroyd is here,” she announced in an excited*",5019,5214,1000,0
66,69087,66,0,"*“I hope you believe me, sir. I’ve been afraid all along the police would rake up that old business with*","*“Going out again?” I asked. “Yes, we will pay a little visit to the good M. Hammond.” “You believe Parker’s*",13756,13956,1000,1
67,69087,67,0,*Then in Servants’ Hall._ _Mrs. Cooper (cook).—In Servants’ Hall._ _Gladys Jones (second housemaid).—In Servants’ Hall._ _Elsie Dale.—Upstairs in bedroom. Seen*,"*Then he looked at me. “You must have indeed been sent from the good God to replace my friend Hastings,”*",1378,2210,1000,0
68,69087,68,0,"*“Blackguard, I thought,” said Blunt. “No,” I said, “only a man with more money than was good for him.” “Oh!*","*In an old collar-box, to be accurate. Funny idea, wasn’t it?” “I think,” said the lawyer, “we ought to make*",10314,11226,1000,0
69,69087,69,0,"*“There is one thing I should like to know from you, mademoiselle. When you were examining the things in the*","*“Oh, do!” I wanted to, so I accepted the invitation without further ceremony. We set out towards the house, Flora*",19285,19557,1000,0
70,69087,70,0,"*“You _are_ weak, James,” said Caroline, quite unmoved. “I’m eight years older than you are—oh! I don’t mind M. Poirot*","*And he is not the same man he was—say, a year ago. His moral fiber is blunted. He is desperate.*",12914,13638,1000,1
71,69087,71,0,"*You know who he is, don’t you?” “We fancied,” I said, “that he might be a retired hairdresser.” Flora’s blue*","*A year ago he retired and came to live down here. Uncle knew who he was, but he promised not*",2966,3014,1000,1
72,69087,72,0,"*It was Friday night, and on Friday night I wind the clocks. I did it as usual, whilst Caroline satisfied*","*Then I banged once more frantically on the door, and stooping down, fairly bawled through the keyhole:— “Ackroyd, Ackroyd! It’s*",7581,8281,1000,0
73,69087,73,0,"*Now, tell me all the circumstances.” “Dr. Sheppard had better tell you,” said Flora. “He knows more than I do.”*","*“I can’t help thinking you’re mistaken, inspector,” said Colonel Melrose warmly. “I’ve known Ralph Paton from a boy upward. He’d*",16798,17743,1000,0
74,69087,74,0,*demanded Melrose. “That is what I find so extraordinary. There seems no rhyme or reason in the thing.” Poirot carefully*,"*“It is a busy time for this young M. Raymond,” murmured M. Poirot. “He has the air efficient, that one.”*",19097,19897,1000,1
75,69087,75,0,"*For a moment Inspector Raglan was taken aback by the question. “It’s difficult to say exactly why he did that,”*",*Poirot lingered about until the inspector had gone back towards the house. Then he looked at me. “You must have*,570,988,1000,0
76,69087,76,0,"*“Yet all the same you came here to find me, did you not? Why was that?” “Because I don’t believe*","*Summoned by her, Ralph came hurriedly down from town. They met in the wood, where part of their conversation was*",11029,11812,1000,1
77,69087,77,0,*“Have the servants been talking?” I asked. “What about?” Mrs. Ackroyd cast a very shrewd glance at me. It quite*,"*It was that girl, Ursula Bourne, wasn’t it? Naturally—she’s leaving. She _would_ want to make all the trouble she could.*",13027,13079,1000,0
78,69087,78,0,"*“You must forgive my unfortunate way of putting things.” “You see, men are so peculiar. In dear Roger’s place, I*","*“Oh, certainly. Absolutely.” I got away at last, after being forced to listen to more justifications of her conduct. The*",2995,3761,1000,0
79,69087,79,0,"*As her income was a large one, and she lived very quietly after her husband’s death, it seems certain that*","*Afterwards, when we were sitting in front of the fire and smoking, Caroline attacked Poirot directly. “Not found Ralph Paton*",4073,4697,1000,1
80,69087,80,0,"*“Who could have been with him at half-past nine?” queried the inspector. “It wasn’t you, Mr.—er——” “Major Blunt,” I said.*","*To make things clear and explain the position, I have appended a rough sketch of the right-hand wing of the*",12532,13255,1000,1
81,69087,81,0,*I enlightened him with a touch of malice. “One of our ample staff of private detectives happened to see you*,"*“Exactly,” said Caroline. “Take James here—weak as water, if I weren’t about to look after him.” “My dear Caroline,” I*",2081,2204,1000,0
82,69087,82,0,*I began to realize that there must be something very wrong indeed somewhere. I had never seen Ackroyd so upset*,"*“You’ve been reading detective stories.” She admitted that she had. “The essence of a detective story,” I said, “is to*",68,879,1000,0
83,69087,83,0,*. PATH . . . . . .. LAWN . . . . . . . . . . .*,"*If, as the inspector thought, the man had wished to hide his face, he might equally well have tried to*",2063,2986,1000,1
84,69087,84,0,"*Not to come forward at such a time. It looks, you know, as though there were something _behind_ it. I*","*I think we all flinched back a little, excepting Geoffrey Raymond, who remained good humored and imperturbable as usual. “How*",1552,2309,1000,0
85,69087,85,0,"*In return for being made young again? There’s an opera about it.” “Faust, you mean?” “That’s the beggar. Rum story.*","*Haven’t got the manners for it. I’m a rough fellow, no use in society. Never remember the things one’s expected*",19022,19195,1000,1
86,69087,86,0,"*“Yes,” I said. “Perhaps you don’t remember the name?” “Oh, yes, of course. I—I remember perfectly.” “She left you just*",*“I thought it was always done. It is in detective fiction anyway. The super detective always has his rooms littered*,8411,9123,1000,0
87,69087,87,0,"*Flora paused a minute, as though to collect her recollections. “I went in and said, ‘Good-night, uncle, I’m going to*",*I nodded. “I realize that.” “You say that Mr. Ackroyd hinted at a suspicion he had that some member of*,12161,12977,1000,0
88,69087,88,0,"*(Confirmed by housekeeper, Miss Russell, who came down to speak to him about something at 9.47, and remained at least*","*“That’s so, of course,” said the inspector. “I shouldn’t put so much stress on the footmarks if it wasn’t for*",7012,7604,1000,0
89,69087,89,0,"*The inspector turned to the butler. “Any one answering that description come to the front door?” “No, sir. No one*",*Parker gave vent to an apologetic cough which brought the inspector’s eyes on him at once. “Well?” he said sharply.*,7825,8408,1000,0
90,69087,90,0,"*Just as I was passing out, she said suddenly in a low voice:— “Excuse me, sir, is there any news*",*I know nothing. But any one who was a friend to him would tell him this: he ought to come*,9394,9466,1000,1
91,69087,91,0,"*My God! yesterday! It seems ten years ago.” I waited a minute, and then he went on. “You understand, Sheppard,*","*No, I won’t even admit to you the wild suspicion that crossed my mind. I’ll tell you this much, though.*",1578,2006,1000,0
92,69087,92,0,*I brought some up with me.” “Good man. Hand them over now.” “They’re in my bag in the hall. I’ll*,"*But of course——” “Of course,” I agreed. “It must have been a man. And you’ve no suspicion at all?” For*",7045,7927,1000,1
93,69087,93,0,*The chairs were big and covered in dark blue leather. A large desk stood by the window and was covered*,*This business of Ralph’s is the last straw. But we won’t talk about that now. It’s the other—the other——! I*,756,1124,1000,1
94,69087,94,0,*Without you I should be lost. I desire a little information from the good Mr. Hammond.” “You are acting on*,"*The lawyer answered the summons. Poirot took my arm and drew me right into the window. “Regard the irises,” he*",1015,1374,1000,1
