,book_idx,excerpt_idx,segment_idx,segment_1,segment_2,seg1_pos,seg2_pos,distance_bin,present_seg1_first
858,72578,88,0,"*“We’re going to get good and wet, though.” Even in the secret passage where they were crouched, the noise of*","*“Well, Tom, how was it?” asked Ned, when the performance was over and they were all together again. “Very good!*",2455,13319,16000,1
859,72578,89,0,"*“That’s what I’ll do, Mr. Swift!” said the shop superintendent. “But where have you been? We’ve had the police for*","*“No, and I suppose we can be thankful for that,” agreed Tom. “But they might just as well have had*",3635,13723,16000,1
860,72578,90,0,"*Then, as he thought the matter over, he was pretty sure that Greenbaum had anticipated what was coming to him*","*As it is, the delay shows they are taking their time and considering the thing from all angles. But I*",1494,11651,16000,0
861,72578,91,0,"*Tom wished he had time to repair it so the machine would show some of the former speed, but this*","*“I’ll do anything, Tom, but eat onions. I hate ’em! Never could touch the things. So outside of that I’m*",1523,13335,16000,0
862,72578,92,0,"*“That was a sharp explosion. Hurry, Rad, and see what it was.” “Yes, sah, Massa Swift, I’s a-hurryin’!” answered Eradicate.*",*It stuck out all over him. He did not seem to mind being made use of for this not very*,77,11049,16000,0
863,72578,93,0,"*But those bars were put there to stay.” “Maybe we can whittle away the wood enough to loosen the screws,”*","*He gave a rather hazy description of the bearer of the sinister warning, but he was able to point out*",4661,14672,16000,1
864,72578,94,0,"*“But they wasn’t dressed so good as what you are—you three I mean,” and he indicated Tom, Mr. Damon and*","*Your voice was very clear. It’s only the vision apparatus that needs improving. How did you make out?” “Oh, I*",7155,18250,16000,0
865,72578,95,0,"*agreed Ned. “We’ll camp out here.” This they did, gathering some dried leaves farther back in the cave, and in*","*We know the path in the dark. And don’t be worried. We aren’t going to hurt you.” “I’m not worried,”*",500,14525,16000,1
866,72578,96,0,"*“But what’s it all about?” asked Mr. Damon as, in his red suit, he joined Ned in the song and*","*snarled Mr. X. “I’ll force him to do as we want him to.” “Oh, so you talk of force now,*",5410,19203,16000,1
867,72578,97,0,"*“That was a sharp explosion. Hurry, Rad, and see what it was.” “Yes, sah, Massa Swift, I’s a-hurryin’!” answered Eradicate.*",*On his left he could hear Mr. Damon beginning to run forward and on his right he caught the sound*,669,10743,16000,1
868,72578,98,0,"*Pushing a button that summoned a messenger, Tom bade the boy send Greenbaum in. And when the man sauntered in,*",*Inside of a month it will be on the market!” “Oh! oh!” wailed Mr. B. Some of the others showed*,4409,19796,16000,1
869,72578,99,0,"*In a way, the fire and blast didn’t mean such a total loss, after all. It helped put me on*","*snarled Mr. X. “I’ll force him to do as we want him to.” “Oh, so you talk of force now,*",3844,18744,16000,1
870,72578,100,0,"*“It was said that the radio would kill the phonograph; and it nearly did, but the phonograph folks came back*","*cried Tom. “How’d you discover it?” “I didn’t,” Ned answered. “It just happened. I bumped against the wall and must*",4333,16682,16000,1
871,72578,101,0,"*The other, and larger, was addressed as Janner. Those two, with Torpy, comprised the kidnapping gang. “If you leave us*","*Though there was jealousy between the two because each one desired to serve Tom alone, when one was in trouble*",5648,15870,16000,1
872,72578,102,0,"*Greenbaum made no answer, but turned and went out of the office. Tom was about to follow, for he did*","*came from three of the men, in evident alarm. “My instructions were,” said Tom, “to come to this island alone.*",1101,16875,16000,0
873,72578,103,0,*It’s all a trick to get money out of you.” But the old man did not appear to be one*,*They did not have long to wait. A motor craft came chugging into view and by dint of shouts and*,677,12938,16000,0
874,72578,104,0,"*Tom said. “Get word to his folks as soon as you can.” “That’s what I’ll do, Mr. Swift!” said the*","*He knew several firms who would be willing to underwrite an issue of bonds, once he could demonstrate that his*",8518,18945,16000,1
875,72578,105,0,"*“If that’s Mary I’m going to speak to her!” exclaimed Tom. “But it isn’t,” said Mrs. Baggert, with a smile,*",*A shake of the head in negation was the only way Ned could reply. Then further talk on Tom’s part*,3224,14368,16000,0
876,72578,106,0,"*“Not this time, Clark,” answered Tom, motioning the young fellow to take a chair near the scorched desk which was*",*Janner suddenly shot at Tom. At once the young inventor saw the drift of the inquiries. There had been some*,2647,13522,16000,0
877,72578,107,0,*gasped Tom. “How did this happen? Koku must be drugged! How did he get that fash? And what does it*,"*“And you said you would pay a good sum to be let alone!” broke in the stout man, who might*",3528,13606,16000,0
878,72578,108,0,*But whether this will help us find Ned or not is another question. You say this kite was blown to*,"*“How dare you threaten me?” Greenbaum made no answer, but turned and went out of the office. Tom was about*",6440,19698,16000,0
879,72578,109,0,"*What else? Bless my spectacles!” “Ned Newton has mysteriously vanished,” said Tom, with a serious face, and he told as*","*cried Tom. “Ned, I believe the spies are at work again!” This seemed very possible when the two compared notes.*",1193,17073,16000,1
880,72600,0,0,"*“One thing,” he said in a low tone, “one thing, your Majesty, I beg, and that is that you will*","*“You mean——” “I mean Ivan himself, chief power among the Muscovites, son of that blind one. He has the ambition*",17936,18066,1000,0
881,72600,1,0,"*You, boy—you trumpet sometimes, I know. Surprises you, does it? Peter has eyes and ears everywhere. So, before we set*","*The Cossack was exulting again that his plans were working, and as he went along he looked about him for*",10815,11527,1000,1
882,72600,2,0,"*In the months that I have been here my teaching has all been in Latin, and I hope, myself, to*","*“But look you—no talking about this anywhere else. This is my business, mine and yours, and I tell you that*",11038,11634,1000,0
883,72600,3,0,"*“Oho,” he exclaimed, “oho! So that’s it. Well, Pan Robber, it seems that your expedition was no ordinary one. No*",*At any rate he was not discovered. When temporary stairs were finally put in place the watchmen released Joseph and*,5404,6243,1000,1
884,72600,4,0,*“Who sent you here?” demanded the latter. Peter was silent. “But you must talk. Do you hear that—below?” It was*,"*Pan Kreutz, who had retired to his loft where he shed his torn gown and his mask, was bleeding and*",11292,12115,1000,1
885,72600,5,0,"*The door to which these steps led was directly above the farther end of the landing, and to Joseph’s surprise*","*In an instant they were in the apartment where the man and girl lived, and Joseph had no further chance*",2607,2672,1000,0
886,72600,6,0,*mused Pan Andrew. “It was in the very center of the burned district.” The answer to his question came with*,*Did you find it perhaps in the ruins of the town? Did you perchance——” The truth suddenly flashed upon him*,19483,19940,1000,1
887,72600,7,0,*And what ought he to do about it? He was for a moment minded to notify the night watch. “I*,"*The alchemist listened. “One—two—three—more! By the lightning, there must be a dozen of them, if footsteps tell no lies. I*",815,1290,1000,1
888,72600,8,0,"*This bell was always employed in times of fire, invasion, defense, and such various events as riots, the visit of*","*“It is I, Elzbietka Kreutz,” she said. “Good father, I come with news that needs action, I think, and that*",13223,14148,1000,0
889,72600,9,0,"*In a space of perhaps a minute, the door was thrown back a little, and Joseph’s mother peered cautiously out*","*“It’s a shame that such a scholar as your uncle should have anything to do with that student, Tring. I*",2949,3086,1000,0
890,72600,10,0,"*I shall be trumpeter, succeeding the man—God rest his soul!—who died but a week ago, since which time there has*","*You may take your exercises with the other boys very soon, however, and go abroad with discretion, for in the*",13263,13392,1000,0
891,72600,11,0,*There the third man headed him off and the two others fell upon him from behind; his slim body wriggled*,"*“The plague upon them all,” exclaimed Peter, dropping Stas. “Here everything is as smooth as water in a lake, then*",6271,6431,1000,0
892,72600,12,0,"*And remember, the lantern in the man’s face to-night. There will be much gold for you. You understand?” The man*","*“Pardon me, master, I thought I had a scent.” The beggar seemed to expect a blow, and assumed a defensive*",15216,15624,1000,1
893,72600,13,0,"*But when the Cossack tossed him aside he lay there feigning unconsciousness, and as the other turned, he reached with*","*Along this he rushed like a meteor, his blazing hair streaming behind him in a trail of sparks—he leaped to*",19215,19495,1000,0
894,72600,14,0,"*“Three of you attack him at once,” directed the leader. There was scuffling again and suddenly the night was made*","*The leader of the attacking party had seized Joseph and thrown a cloth bag over his head. “To the house,”*",17519,17595,1000,0
895,72600,15,0,"*Our old teachings are all of the great Aristotle, and yet we have never read anything of him in the*","*He had scarcely finished, amid much acclaim, when a Polish scholar mounted the pedestal and began to read some of*",5011,5079,1000,1
896,72600,16,0,"*You can sleep here to-night if you wish, and to-morrow I will ask my father what can be done.” He*",*The powers of the sky may be found by those who search the skies.” “But is not the conduct and*,6617,7262,1000,0
897,72600,17,0,"*“I will tell you everything,” said the father as they sat down to the noonday meal. “This oath which I*","*“We shall be happy here,” the woman exclaimed, “that I know, and here is one that needs a mother’s love.”*",10937,11370,1000,0
898,72600,18,0,"*It was said with such gravity and such an air of wisdom that at first Joseph was inclined to smile,*","*. . . That is the boy.” The other started and turned quickly, but appeared puzzled. “When did you say*",13760,13881,1000,1
899,72600,19,0,"*“Then let our experiments be brief,” said the alchemist. “I have looked too long upon this glittering thing.” “You should*","*“But, in truth,” went on the alchemist, “I doubt if we can wring that secret from the crystal. I have*",11435,11468,1000,1
900,72600,20,0,"*“Stop! Stop! We are friends,” the first of them called out. “We would not harm a woman in the street*","*“Elzbietka—Elzbietka,” he kept repeating. “She heard me sound the trumpet in a different fashion from the way I usually sound*",11347,12143,1000,1
901,72600,21,0,*Among the most remarkable personages of Krakow’s age of glory in the fifteenth century was a certain scholar-priest by the*,"*“My—my—but surely you have friends in town?” “I have none. I had a friend here and sought him, but he*",9802,10246,1000,1
902,72600,22,0,"*Mount carefully, but rush and secure both father and son when I give you word.” Here he fitted the key*",*In a very few minutes they were all inside. The last man following directions closed the iron door so that*,5964,6016,1000,0
903,72600,23,0,*The joiners’ and the tailors’ guilds had watchtowers near this gate. Between these watchtowers and the church were many palaces*,"*My father had teachers for me when I was eight years old, and since then I have worked much with*",16222,16755,1000,1
904,72600,24,0,"*Let God give. . . . There would be something. Aimlessly he got into the wagon, turned it about, and*","*He had dealt with dogs many times in the Ukraine, and he knew that no dog is vicious if healthy*",7698,8656,1000,0
905,72600,25,0,*He had scarcely finished when Pan Andrew sprang to his feet and struck the back of his chair with his*,*It was not that he had lost so much hair that certain ones called him behind his back Bogdan of*,9125,9398,1000,0
906,72600,26,0,"*“I seek Pan Andrew Tenczynski.” The guard shouted something, whereat five men in armor came running from a little house*","*I am here for the observance of order, for the protection of the estate against enemies of the family.” Pan*",6685,7011,1000,0
907,72600,27,0,*And as to this I do not doubt that a restorer of youth can be found. Yet I am not*,"*“Something of this you have proven to me,” said the alchemist. “Then use your higher brain,” commanded Tring. “To what*",18814,19579,1000,0
908,72600,28,0,"*Joseph,” she spoke in a very low tone, “do you know I think that my uncle is possessed?” He gave*","*“Ay—perhaps,” she meditated—“but I loved him better as he was.” From that time on Elzbietka became more and more a*",247,476,1000,0
909,72600,29,0,"*“What is it?” “A dog,” answered the boy, “a friendly dog.” “Bring him along with us,” said the father with*","*And your name?” he thundered at the other. “Conrad Mlynarki of Mazovia,” answered the student, thrusting his weapon back into*",13906,14627,1000,1
910,72600,30,0,"*Pan Charnetski, trying to force his way out of the circle, was pushed back into the center by one of*","*“But—I must remain here. A band of pillagers, I know not whom exactly, though I think them the paid robbers*",6518,7146,1000,0
911,72600,31,0,"*Her one hope now was that Jan Kanty would answer his bell quickly, for if she did not slip inside*","*“Good father, I come with news that needs action, I think, and that immediately. But first close the door, since*",10685,10810,1000,1
912,72600,32,0,"*They rolled back and forth across the floor, tight in each other’s arms, they broke table legs, they brought down*","*He stopped there only for one fleeting glance below. The court, blazing with torches and alive with tumult, was full*",2647,3099,1000,1
913,72600,33,0,"*“On the floor, reverend sir,” she answered. “And the aches and pains are so strong that I can stand them*","*“No, reverend sir, except in spring.” “Is the earth damp beneath the stones?” “Why—yes—perhaps,” she said. “Sometimes when the well*",4990,5042,1000,0
914,72600,34,0,"*“You are a fool, you, Pan Kreutz,” he said. “Here are you, the most gifted scholar and alchemist of our*","*It is the lesser brain.” “Something of this you have proven to me,” said the alchemist. “Then use your higher*",18152,18464,1000,0
915,72600,35,0,"*Besides, I am not an astrologer. I am an alchemist. The powers of the sky may be found by those*",*“Then why do you not keep trying until you find the secret?” The alchemist drew a long breath. “There are*,19246,19630,1000,1
916,72600,36,0,"*Go to your room! I will hear your story to-morrow. And you”—he turned to the remnants of the original crowd,*","*Jan Kanty reached up and pulled the wire which hung down from above the door, and in a few minutes*",5949,6684,1000,1
917,72600,37,0,"*For there might come a time when I should be ill, or perhaps even wounded—who knows, since I have so*","*. . . Well, I must sleep. A good night to you.” And he went in through the open door.*",10123,11075,1000,1
918,72600,38,0,"*What has happened?” “My uncle,” she cried, “Joseph, I know not what they are doing.” “I thought you were with*","*Then my uncle said, ‘No, that will kill.’ Then the student laughed a terrible laugh. After that there was a*",13393,13571,1000,0
919,72600,39,0,"*“And now I understand,” he continued. “Indeed you have been under the hand of a devil if you have been*","*“Yes, the crystal was actually in the hands of the leader when I surprised him with an explosive powder. In*",14389,15336,1000,0
920,72600,40,0,*Hypnotism in the days when all men and women were to an extent superstitious was looked upon as one of*,*The alchemist whipped the cloth covering away. It was as if he had uncovered a diamond of the finest water!*,18199,18604,1000,0
921,72600,41,0,"*A girl of her age was just such prey as these wretched people sought, for they could plunder her without*",*In the meantime the band of Cossacks high up in the tower above had begun to grow weary of this*,9280,9842,1000,1
922,72600,42,0,"*“Look in the bed,” the leader spoke. Pan Andrew and his wife slept in a large bed in the front*",*“Some one take him and throw him down to the dog. Then he can take what gold we choose to*,5005,5175,1000,0
923,72600,43,0,"*He is so changed!” “I have seen,” Joseph’s mother replied. “But has he ever been cruel to you?” “Oh, no!*","*Then again there is silence and my uncle speaks shortly, mad things—and I was frightened and came here.” “My poor*",1645,2043,1000,0
924,72600,44,0,"*. And the poor child—she lost her father and mother in the plague? Indeed, I think that God must have*",*Then came a peasant who complained that worms were coming up from the ground and were destroying the young shoots*,6228,7222,1000,0
925,72600,45,0,"*his name was a power on both sides of the boundary, for in Poland also he had confederates who served*","*The world had been going well with him, he reflected, as he made his way through the dark and well-nigh*",13110,13623,1000,0
926,72600,46,0,"*The alchemist rose from his stool and turned upon Tring. “You who have powers greater than man, know most of*","*Diamonds, as well, possess this fascinating power to a high degree though the diamond is, of course, a small stone,*",18102,18795,1000,1
927,72600,47,0,"*In those times no man was allowed to look more than three minutes upon it, for even in three minutes*","*“Would the robbers taken prisoners say nothing?” “No, they did not know all, I believe. And like most Tartars they*",13557,14038,1000,0
928,72600,48,0,*. . . A brave story.” “Well”—Joseph liked to see the blue eyes widen—“one night the Tartars will attack the*,"*Against the palaces that lined the open space there were more shadows, and moving like shadows within these shadows, promenaded*",8539,9144,1000,0
929,72600,49,0,*Come here when there is anything to trouble you. . . . The little bed is always yours. . .*,"*A little ball of black stone would prevent the possessor from being bitten by snakes. The little yellow, glasslike substance,*",17282,18217,1000,1
930,72600,50,0,"*A fifth brazier, not now alight, hung close to the window where Joseph was peering, and it was from this*","*Fire melts, water changes the color or disintegrates, air hardens, and earth darkens. To make brass of gold, or gold*",17648,18374,1000,1
931,72600,51,0,*At this moment Pan Andrew and the others came up to them. In the light of the lantern Joseph glanced*,"*“All will be well now,” said Joseph’s father. “We need not trouble you further.” “It has been otherwise than trouble,”*",4669,5331,1000,1
932,72600,52,0,"*The boy obeyed, but as he leaped from the wagon and grasped at the horse’s bit thong, he came to*",*“To strangers I am Pan[1] Andrew Charnetski.” [1] Pan is a formal Polish term signifying Sir or Mr. The stranger*,2741,3216,1000,1
933,72600,53,0,"*“I can’t get near him without injury,” he whispered loudly to the leader of the party. “He sank his teeth*",*“Come back! Come back!” they were shouting from below. “Come up! Come up!” he commanded. “What are you frightened of?”*,14260,15259,1000,0
934,72600,54,0,*At that a great skulk in the crowd let fly a stone at the three which missed Pan Andrew but*,"*He is a wizard, yea, and one condemned by church and court and precept. At him! Kill him! But save*",2498,2596,1000,1
935,72600,55,0,"*“We shall be happy here,” the woman exclaimed, “that I know, and here is one that needs a mother’s love.”*","*It lacked flying buttresses and distinct Gothic ornamentation such as huge gargoyles and flowers and saints carved in stone, though*",7857,8099,1000,0
936,72600,56,0,"*“Bless the girl,” said the father, tears rising to his eyes. “And you, my son, how did you get free?*",*For what other reason could he have surprised him thus in the tower? For what other reason the hurried expedition*,19388,19528,1000,1
937,72600,57,0,"*He intended to say more, but was interrupted by a curious sound that came from outside as if a heavy*","*By the side of the trumpet lay two parchment scripts, one of them evidently a copy of a long piece*",18776,19507,1000,1
938,72600,58,0,*“There are things that interest me more. Though I am an alchemist I am much concerned with the spirit which*,"*With this secret, you and I could become the very kings of the earth. We could live in the finest*",9768,10337,1000,1
939,72600,59,0,"*“They disappeared that day after the riot,” he thought to himself as he sat in the inn, “and were nowhere*",*The man at the inn continued to ruminate. “That stoop-shouldered misbegotten thing that calls himself Stas came to us like*,17492,17940,1000,0
940,72600,60,0,"*For what other reason the hurried expedition into the town with the boy, Joseph, and the instructions he had left*","*Above their heads on the slanting walls vials and glass tubes of the alchemist’s craft gleamed like precious stones, and*",17922,18123,1000,1
941,72600,61,0,"*“Three of you attack him at once,” directed the leader. There was scuffling again and suddenly the night was made*","*“Come up! Come up!” he commanded. “What are you frightened of?” “It is the Evil One, himself!” Peter shook his*",2404,3383,1000,1
942,72600,62,0,*Forces of men armed with hooks and axes were sent out by the water master to surround the district where*,*There was nothing to do but to push on through the Street of the Pigeons where it curves to meet*,11933,12432,1000,0
943,72600,63,0,"*Joseph noticed a distinct change in the student’s voice as he said this; his eyes shone with a greedy light,*","*The alchemist was looking into the fire. Tring, sitting beside him, cast at him at these words such a malicious*",17598,18182,1000,1
944,72600,64,0,"*Out into a wide court they went, following the courtier in blue, up a marble staircase to the left and*","*And his curiosity, I now believe, led him to spy upon me, and eventually he discovered the use to which*",15393,16383,1000,1
945,72600,65,0,"*The Heynal began. “That is Joseph,” she thought. She was humming the tune, already following him note by note—she reached*","*Joseph was in some strange, some unusual kind of distress! He counted upon her to remember the little secret that*",13349,13846,1000,0
946,72600,66,0,*In the center of the room stood a tripod supporting an iron basin and in it was burning some substance*,"*Something new is created. I melt lead and silver and copper, and they form together some metal that is new.”*",11581,11718,1000,0
947,72600,67,0,"*Peter nodded. The Heynal was not new to him, and he knew that the boy was playing as usual—that is,*",*I fear that young man very much. He seems to me like one who has grown old and then become*,10379,10837,1000,0
948,72600,68,0,*That Pan Andrew would gladly give up the crystal to save not only his own life but that of the*,*And it seemed curious that he too was called upon to show his mettle in much the same way. In*,18409,18796,1000,1
949,72600,69,0,"*“Then I have just the thing. You were a hunter in the old days, I presume?” “Why, yes,” said Pan*","*“No, reverend sir, except in spring.” “Is the earth damp beneath the stones?” “Why—yes—perhaps,” she said. “Sometimes when the well*",45,646,1000,1
950,72600,70,0,"*For when Ivan, himself, promises, then there is profit to be had. I return to the Ukraine, but there is*","*For there were many such as Bogdan the Terrible, or as the Poles knew him, Peter of the Button Face,*",8950,9898,1000,1
951,72600,71,0,*If only he would not smile! If only he would not think that she had been dreaming! But the venerable*,*Pan Andrew was busy with his own thoughts when the watch finally marched away with their prisoners. The Great Tarnov*,8475,9059,1000,0
952,72600,72,0,*And he stepped forward toward the driver. Charnetski hesitated no longer. In the flash of an eye he had vaulted*,"*As for money, there might be found zloty and guilder and groschen, silver in bars and precious stones, also plenty*",1173,2153,1000,0
953,72600,73,0,"*He is just as intelligent and just as kind as he ever was, but he has become so interested in*","*“Yes,” she answered. “How, when the Tartars burned the city, the trumpeter stayed on duty and played the hours as*",1233,1857,1000,0
954,72600,74,0,"*. . . It was curious that to-night when you were in the deepest part of the trance, you called*","*When the Month of the Heather had passed by and the Month of Hemp Beating was at hand, Joseph had*",596,1035,1000,0
955,72600,75,0,"*Pan Andrew was already adjusting the harnesses when Joseph tugged at his sleeve. “Father,” he urged, “father, I know of*","*You have enemies in the city, you believe, and therefore you must remain for the present unseen. I advise a*",11279,11797,1000,0
956,72600,76,0,"*A light snow was falling on the last Wednesday of the month, when Pan Andrew started for his nightly duties*","*Then all at once came an exclamation of pain in a voice that he recognized as Stas’. More whispering, and*",17677,18621,1000,0
